{
  "contract_version": 1,
  "release_version": "0.0.0-phase0",
  "commit": "47775135e456cd8db3c80f4dfde0afaf1273296b",
  "source_date_epoch": 1785081600,
  "target": {
    "os": "macos",
    "architecture": "aarch64",
    "abi": "darwin"
  },
  "toolchains": [
    {
      "name": "rust",
      "version": "1.97.1"
    }
  ],
  "contracts": {
    "artifact_manifest": 1,
    "capability_manifest": 1,
    "diagnostics": 1,
    "handler_protocol": 1,
    "native_ui": 1,
    "route_manifest": 1,
    "view_ir": 1
  },
  "outputs": [
    {
      "path": "bin/ty",
      "sha256": "aaaaaaaaaaaaaaaaaaaaaaaaaaaaaaaaaaaaaaaaaaaaaaaaaaaaaaaaaaaaaaaa",
      "size": 1024
    }
  ]
}
